{
  "schemaVersion": "reference-review-receipt.v1",
  "receiptId": "rrr_c04_r09_keycloak_adopt",
  "workPackageId": "C04",
  "reviewMode": "RETROSPECTIVE_BACKFILL",
  "reviewBoundary": "IMPLEMENTATION_CONFORMANCE",
  "applicableReferenceSetDigest": "sha256:6bbb1914dadf932b52486e106772272263722b7d9b22070a3780cc7c6fdf2844",
  "referenceCatalogSha256": "sha256:db37fa9e04dfe5468ef97e13de55c7702b919040fc78755d33a8db7d1018523a",
  "referencePolicySha256": "sha256:6402d72d3d7c0a88c362a2dbb376645dabc13c2aceb47825cb02fa031428836d",
  "profileSha256": "sha256:ed6836e5e212a95b66dd386e8bfbe1cf6aa5f37c1b281cfb0514e9aa9f7213f5",
  "referenceId": "R09.KEYCLOAK",
  "referenceKind": "OPEN_SOURCE_PROJECT",
  "referenceName": "Keycloak",
  "officialSources": [
    {
      "sourceId": "src_keycloak_docs",
      "uri": "https://www.keycloak.org/documentation",
      "sourceKind": "OFFICIAL_DOCUMENTATION",
      "authority": "Keycloak",
      "observedAt": "2026-07-30T00:00:00.000Z",
      "contentEvidenceRef": "implementation/governance/reference-review/p2-profile-backfill-official-research.v1.md",
      "contentSha256": "sha256:f1c3ad5461d254157b14c16a3b03be606dab44180ba9d06b056c94a5a0505f90"
    },
    {
      "sourceId": "src_keycloak_repository",
      "uri": "https://github.com/keycloak/keycloak",
      "sourceKind": "OFFICIAL_SOURCE_REPOSITORY",
      "authority": "Keycloak",
      "observedAt": "2026-07-30T00:00:00.000Z",
      "contentEvidenceRef": "implementation/governance/reference-review/p2-profile-backfill-official-research.v1.md",
      "contentSha256": "sha256:f1c3ad5461d254157b14c16a3b03be606dab44180ba9d06b056c94a5a0505f90"
    }
  ],
  "reviewedMaterials": [
    {
      "materialId": "mat_r09_keycloak_src_keycloak_docs",
      "sourceId": "src_keycloak_docs",
      "materialKind": "DOCUMENTATION",
      "documentationVersion": "26.7.0",
      "sourceCommit": null,
      "release": null,
      "imageDigest": null,
      "artifactDigest": null
    },
    {
      "materialId": "mat_r09_keycloak_src_keycloak_repository",
      "sourceId": "src_keycloak_repository",
      "materialKind": "RELEASE",
      "documentationVersion": "26.7.0",
      "sourceCommit": null,
      "release": "26.7.0",
      "imageDigest": null,
      "artifactDigest": "sha256:f771df0aa1e4820f57d56f7d6d015beb6415487b43f8de7e5a6d48f8a7fe118a"
    }
  ],
  "reviewedSections": [
    {
      "sourceId": "src_keycloak_docs",
      "locator": "p2-profile-backfill-official-research:R09.KEYCLOAK",
      "topic": "Keycloak exact version, capability, license, security, maintenance and exit boundary",
      "notesRef": "implementation/governance/reference-review/p2-profile-backfill-official-research.v1.md",
      "notesDigest": "sha256:f1c3ad5461d254157b14c16a3b03be606dab44180ba9d06b056c94a5a0505f90"
    },
    {
      "sourceId": "src_keycloak_repository",
      "locator": "p2-profile-backfill-official-research:R09.KEYCLOAK",
      "topic": "Keycloak exact version, capability, license, security, maintenance and exit boundary",
      "notesRef": "implementation/governance/reference-review/p2-profile-backfill-official-research.v1.md",
      "notesDigest": "sha256:f1c3ad5461d254157b14c16a3b03be606dab44180ba9d06b056c94a5a0505f90"
    }
  ],
  "reviewedAt": "2026-08-14T00:00:00.000Z",
  "capabilityGap": {
    "summary": "The formal Reference Review decision for Keycloak was missing from the Profile-bound evidence chain.",
    "currentMeasure": "The implementation and historical verification bytes exist, but the formal Receipt and Bundle were absent.",
    "targetMeasure": "One exact retrospective ADOPT Receipt is bound to the fixed synthetic source, version, evidence and successor Policy.",
    "evidenceRef": "implementation/governance/reference-review/p2-profile-backfill-official-research.v1.md",
    "evidenceHash": "sha256:f1c3ad5461d254157b14c16a3b03be606dab44180ba9d06b056c94a5a0505f90"
  },
  "currentImplementation": {
    "status": "IMPLEMENTED",
    "summary": "Keycloak 26.7.0 adapter integration for the C04 P1 synthetic identity boundary. This status is limited to P1_SYNTHETIC_ONLY; Real enterprise identity providers, production SCIM, HA, TLS, secrets, backup and recovery remain outside this decision.",
    "evidenceRefs": [
      "implementation/p1/c04/c04-verification-evidence.v1.json",
      "implementation/p1/c04/keycloak/keycloak-distribution.lock.json"
    ],
    "evidenceHashes": [
      "sha256:554df39362987342eaab88b5146b04a70bc3db8b566a81c6af5b1866816063de",
      "sha256:c886967c1c9abc87ace8fa52a4f8cf5a93f80fae0ca2e10c881e8fe149121555"
    ]
  },
  "alternativesCompared": [
    {
      "alternativeId": "alt_current_r09_keycloak",
      "name": "Unformalized current P1 implementation",
      "kind": "CURRENT_IMPLEMENTATION",
      "versionOrStandard": "P1_SYNTHETIC_BASELINE",
      "advantages": [
        "No additional formal evidence artifact."
      ],
      "risks": [
        "The Profile-bound Reference Review contract remains unproved."
      ],
      "disposition": "FALLBACK"
    },
    {
      "alternativeId": "alt_r09_keycloak",
      "name": "Keycloak",
      "kind": "OPEN_SOURCE_PROJECT",
      "versionOrStandard": "26.7.0",
      "advantages": [
        "Matches the fixed implemented P1 synthetic artifact and source anchor."
      ],
      "risks": [
        "Real enterprise identity providers, production SCIM, HA, TLS, secrets, backup and recovery remain outside this decision."
      ],
      "disposition": "SELECTED"
    }
  ],
  "licenseAndRedistributionAssessment": {
    "licenseId": "Apache-2.0",
    "licenseSourceId": "src_keycloak_repository",
    "reviewedVersion": "26.7.0",
    "usageMode": "P1_SYNTHETIC_ONLY",
    "distributionMode": "LOCAL_TEST_ARTIFACT_ONLY",
    "obligations": [
      "Preserve the applicable upstream license and notices."
    ],
    "brandRestrictions": [
      "Do not imply upstream endorsement."
    ],
    "commercialRestrictions": [
      "No restriction beyond the reviewed upstream license terms."
    ],
    "conclusion": "ACCEPTABLE",
    "rationale": "The fixed synthetic-only use is compatible with the reviewed upstream license; production review remains separate."
  },
  "securityAndDataFlowAssessment": {
    "dataClasses": [
      "SYNTHETIC_ONLY"
    ],
    "ingress": [
      "Fixed P1 synthetic test inputs."
    ],
    "egress": [
      "P1 synthetic test results and closed engineering evidence."
    ],
    "storage": [
      "Local P1 synthetic test state."
    ],
    "networkAccess": [
      "Only the already verified P1 integration boundary; no production authorization."
    ],
    "privileges": [
      "Least-privilege P1 synthetic test roles."
    ],
    "secretHandling": [
      "No real enterprise credential or production secret is authorized."
    ],
    "trustBoundaries": [
      "Exact sourceCommit and Git-frozen evidence bytes."
    ],
    "knownRisks": [
      "Real enterprise identity providers, production SCIM, HA, TLS, secrets, backup and recovery remain outside this decision."
    ],
    "conclusion": "ACCEPTABLE",
    "rationale": "The decision is limited to the fixed P1 synthetic implementation and does not approve production."
  },
  "maintenanceAndExitAssessment": {
    "operationalOwnerRole": "REFERENCE_REVIEW_OWNER",
    "upstreamHealth": "Monitor the exact upstream release before any future version change.",
    "upgradeCadence": "A version change requires a new exact-pin review.",
    "onCallResponsibility": "No production on-call obligation is created by this P1 evidence.",
    "backupAndRecoveryResponsibility": "Production backup and recovery remain unapproved and deferred.",
    "costResponsibility": "No production spend is authorized.",
    "exitPlanStatus": "DEFINED",
    "exitPlan": "Remove or replace the adapter or migration and rerun the same synthetic conformance evidence.",
    "migrationTarget": "A separately reviewed compatible implementation.",
    "stopMaintenanceTrigger": "Security advisory, version change, candidate-set change, or unsupported upstream."
  },
  "decision": "ADOPT",
  "decisionReason": "Adopt Keycloak 26.7.0 only for the exact already implemented P1 synthetic scope and artifact digest.",
  "alternativePath": null,
  "reReviewTrigger": null,
  "notApplicableReason": null,
  "pocRequired": true,
  "pocResult": {
    "status": "PASS",
    "summary": "The existing direct v1 implementation Evidence records the fixed P1 synthetic verification.",
    "evidenceRefs": [
      "implementation/p1/c04/c04-verification-evidence.v1.json"
    ],
    "evidenceHashes": [
      "sha256:554df39362987342eaab88b5146b04a70bc3db8b566a81c6af5b1866816063de"
    ]
  },
  "adrRef": "docs/adr/0026-p1-reference-backfill-formal-decisions.md",
  "ownerRole": "REFERENCE_REVIEW_OWNER",
  "evidenceRefs": [
    "docs/adr/0026-p1-reference-backfill-formal-decisions.md",
    "implementation/governance/reference-review/p2-profile-backfill-official-research.v1.md",
    "implementation/governance/reference-review/p2-profile-backfill-preparation.v1.json",
    "implementation/p1/c04/c04-verification-evidence.v1.json",
    "implementation/p1/c04/keycloak/keycloak-distribution.lock.json"
  ],
  "evidenceHashes": [
    "sha256:2778e5736a69aadca4ec916e10bdc7b1ae6d71cf185c8eee5ee62713572331c4",
    "sha256:f1c3ad5461d254157b14c16a3b03be606dab44180ba9d06b056c94a5a0505f90",
    "sha256:87dc381514008bf406797012e5941bc4363c60c68e887d1c4448c1db7e95955b",
    "sha256:554df39362987342eaab88b5146b04a70bc3db8b566a81c6af5b1866816063de",
    "sha256:c886967c1c9abc87ace8fa52a4f8cf5a93f80fae0ca2e10c881e8fe149121555"
  ],
  "sourceCommit": "bc718bc1a069deaa388b9a00e0135c8e9427dd91",
  "supersedesReceiptId": null,
  "governanceEffect": "NONE",
  "isProgressTracker": false,
  "selfAuthorizing": false,
  "productionAdoptionClaim": false,
  "receiptSha256": "sha256:eaffb1a1d0d2eacf50428ec706e505087008242d054131290d640b33dcc0c835"
}
